{
  "$schema": "https://json-schema.org/draft/2020-12/schema",
  "$id": "https://performing-fire-corpus.invalid/schemas/v1/object.json",
  "title": "Object record v1",
  "type": "object",
  "additionalProperties": false,
  "required": [
    "schema_version",
    "record_type",
    "object_id",
    "asset_id",
    "source_id",
    "public_url",
    "object_key",
    "byte_size",
    "media_type",
    "sha256"
  ],
  "properties": {
    "schema_version": {
      "const": 1
    },
    "record_type": {
      "const": "object"
    },
    "object_id": {
      "type": "string",
      "pattern": "^object_[a-z0-9][a-z0-9._-]{0,127}$"
    },
    "asset_id": {
      "type": "string",
      "pattern": "^asset_[a-z0-9][a-z0-9._-]{0,127}$"
    },
    "source_id": {
      "type": "string",
      "pattern": "^(?:source_[a-z0-9][a-z0-9._-]{0,127}|[a-z]+(?:-[a-z]+)*)$"
    },
    "public_url": {
      "type": "string",
      "format": "uri",
      "pattern": "^https://[^/\\s]+(?:/[^\\s]*)?$",
      "maxLength": 2048
    },
    "object_key": {
      "type": "string",
      "pattern": "^(?!/)(?!.*(?:^|/)\\.{1,2}(?:/|$))(?!.*\\\\)[A-Za-z0-9][A-Za-z0-9._/-]{0,511}$"
    },
    "byte_size": {
      "type": "integer",
      "minimum": 0
    },
    "media_type": {
      "type": "string",
      "pattern": "^[a-z0-9][a-z0-9!#$&^_.+-]{0,63}/[a-z0-9][a-z0-9!#$&^_.+-]{0,63}$"
    },
    "sha256": {
      "type": "string",
      "pattern": "^[0-9a-f]{64}$"
    },
    "attempt_state": {
      "enum": [
        "uploaded",
        "reused"
      ]
    },
    "evidence_ref": {
      "type": "string",
      "minLength": 1,
      "maxLength": 256,
      "pattern": "^[A-Za-z0-9][A-Za-z0-9._:-]{0,255}$"
    }
  }
}
