{
  "schema_version": 1,
  "record_type": "object",
  "object_id": "object_synthetic_video_001",
  "asset_id": "asset_synthetic_video_001",
  "source_id": "source_njp_synthetic",
  "public_url": "https://njpvideo.ggcf.kr/synthetic/item-001",
  "object_key": "raw/synthetic/video-001.mp4",
  "byte_size": 1024,
  "media_type": "video/mp4",
  "sha256": "aaaaaaaaaaaaaaaaaaaaaaaaaaaaaaaaaaaaaaaaaaaaaaaaaaaaaaaaaaaaaaaa"
}
